[
  {
    "id": "apr_fixture_001",
    "requested_by": "owner",
    "approved_by": null,
    "action_type": "fixture.action",
    "permission_requested": "system.run_doctor.readonly",
    "scope": {
      "fixture": true
    },
    "risk_level": "low",
    "files_affected": [],
    "rollback_plan": "Eliminar fixture.",
    "status": "requested",
    "expires_at": "2026-12-31T23:59:59Z",
    "evidence_ref": null,
    "created_at": "2026-05-31T00:00:00Z",
    "approved_at": null,
    "consumed_at": null,
    "scope_hash": "aaaaaaaaaaaaaaaaaaaaaaaaaaaaaaaaaaaaaaaaaaaaaaaaaaaaaaaaaaaaaaaa",
    "idempotency_key": null,
    "consumed_by_action_id": null
  }
]
